{
  "schema_version": "0.1.0-draft",
  "session_id": "session-synthetic-001",
  "container_format": "synthetic-fixture-v1",
  "provenance": "synthetic",
  "status": "complete",
  "files": [
    {
      "schema_version": "0.1.0-draft",
      "artifact_id": "frame-payload",
      "path": "data/frame-mono8.raw",
      "bytes": "64",
      "sha256": "fdeab9acf3710362bd2658cdc9a29e8f9c757fcf9811603a8c447cd1d9151108",
      "media_type": "application/octet-stream",
      "provenance": "synthetic"
    },
    {
      "schema_version": "0.1.0-draft",
      "artifact_id": "synthetic-circle-profile",
      "path": "data/profile-circle.csv",
      "bytes": "2395",
      "sha256": "e95b272bac0d16bcd8085ec2e210123fbd68c1936b15e8885502b3ee27144420",
      "media_type": "text/csv",
      "provenance": "synthetic"
    }
  ],
  "stream_ids": [
    "stream-01"
  ],
  "frame_count": "1",
  "gap_ranges": [],
  "closed_reason": "normal",
  "notes": "Contract fixture only. This is not an MCAP recording and not a camera or throughput acceptance result."
}
